{
  "authorization_version": "0.2",
  "receipt_id": "ar2-forum-route-0001",
  "kind": "authorization-grant",
  "nonce": "0123456789abcdef0123456789abcdef",
  "agent_id": "agent:router-7",
  "action": "lane.call",
  "target": "forum/forum_route",
  "issued_at": "2026-08-02T12:00:00Z",
  "expires_at": "2026-08-02T12:05:00Z",
  "max_actions": 1,
  "revoked": false,
  "policy_ref": "policy:flywheel/governance/v1",
  "notes": "Inner structure only. External trust and atomic consumption are separate checks."
}
